{
  "schemaVersion": "1.0.0",
  "offsetUnit": "UNICODE_CODE_POINT",
  "sourceFormat": "TEXT",
  "pages": [],
  "blocks": [
    {
      "id": "10000000-0000-4000-8000-000000000025",
      "kind": "heading",
      "parentId": null,
      "sectionId": "10000000-0000-4000-8000-000000000027",
      "text": "추진 계획",
      "sourceText": "추진 계획",
      "units": [
        {
          "id": "10000000-0000-4000-8000-000000000026",
          "kind": "fragment",
          "start": 0,
          "end": 5,
          "text": "추진 계획"
        }
      ],
      "sourceRefs": []
    },
    {
      "id": "10000000-0000-4000-8000-000000000028",
      "kind": "para",
      "parentId": "10000000-0000-4000-8000-000000000025",
      "sectionId": "10000000-0000-4000-8000-000000000027",
      "text": "교육 완료.  조사 예정.",
      "sourceText": "교육 완료.  조사 예정.",
      "units": [
        {
          "id": "10000000-0000-4000-8000-000000000029",
          "kind": "sentence",
          "start": 0,
          "end": 6,
          "text": "교육 완료."
        },
        {
          "id": "10000000-0000-4000-8000-000000000030",
          "kind": "sentence",
          "start": 8,
          "end": 14,
          "text": "조사 예정."
        }
      ],
      "sourceRefs": []
    },
    {
      "id": "10000000-0000-4000-8000-000000000031",
      "kind": "para",
      "parentId": "10000000-0000-4000-8000-000000000025",
      "sectionId": "10000000-0000-4000-8000-000000000027",
      "text": "가😀나",
      "sourceText": "가😀나",
      "units": [
        {
          "id": "10000000-0000-4000-8000-000000000032",
          "kind": "fragment",
          "start": 0,
          "end": 3,
          "text": "가😀나"
        }
      ],
      "sourceRefs": []
    },
    {
      "id": "10000000-0000-4000-8000-000000000033",
      "kind": "item",
      "parentId": "10000000-0000-4000-8000-000000000025",
      "sectionId": "10000000-0000-4000-8000-000000000027",
      "text": "주민 의견 수렴 및 사업계획 반영",
      "sourceText": "주민 의견 수렴 및 사업계획 반영",
      "units": [
        {
          "id": "10000000-0000-4000-8000-000000000034",
          "kind": "fragment",
          "start": 0,
          "end": 18,
          "text": "주민 의견 수렴 및 사업계획 반영"
        }
      ],
      "sourceRefs": []
    },
    {
      "id": "10000000-0000-4000-8000-000000000039",
      "kind": "table",
      "parentId": "10000000-0000-4000-8000-000000000025",
      "sectionId": "10000000-0000-4000-8000-000000000027",
      "sourceRefs": [],
      "rowCount": 1,
      "columnCount": 2,
      "structureStatus": "complete",
      "cells": [
        {
          "id": "10000000-0000-4000-8000-000000000035",
          "row": 0,
          "column": 0,
          "rowspan": 1,
          "colspan": 1,
          "text": "2026. 10. 17.",
          "sourceText": "2026. 10. 17.",
          "units": [
            {
              "id": "10000000-0000-4000-8000-000000000036",
              "kind": "fragment",
              "start": 0,
              "end": 13,
              "text": "2026. 10. 17."
            }
          ],
          "sourceRefs": []
        },
        {
          "id": "10000000-0000-4000-8000-000000000037",
          "row": 0,
          "column": 1,
          "rowspan": 1,
          "colspan": 1,
          "text": "1,000,000원",
          "sourceText": "1,000,000원",
          "units": [
            {
              "id": "10000000-0000-4000-8000-000000000038",
              "kind": "fragment",
              "start": 0,
              "end": 10,
              "text": "1,000,000원"
            }
          ],
          "sourceRefs": []
        }
      ],
      "unresolvedSlots": [],
      "headerRelations": {
        "status": "resolved",
        "items": []
      },
      "unitNoteRefs": []
    }
  ],
  "sections": [
    {
      "id": "10000000-0000-4000-8000-000000000027",
      "headingBlockId": "10000000-0000-4000-8000-000000000025",
      "parentSectionId": null
    }
  ],
  "warnings": []
}
